[2025-11-19 05:41:23] 📡 Starting transcript sync...
[2025-11-19 05:41:23] ⚠️ Failed: https://raw.githubusercontent.com/forgedbyfreedom/forged-by-freedom-st/main/transcripts/ThinkBigBodybuilding.txt → 404 Client Error: Not Found for url: https://raw.githubusercontent.com/forgedbyfreedom/forged-by-freedom-st/main/transcripts/ThinkBigBodybuilding.txt
[2025-11-19 05:41:23] ⚠️ Failed: https://raw.githubusercontent.com/forgedbyfreedom/forged-by-freedom-st/main/transcripts/AnabolicBodybuilding.txt → 404 Client Error: Not Found for url: https://raw.githubusercontent.com/forgedbyfreedom/forged-by-freedom-st/main/transcripts/AnabolicBodybuilding.txt
[2025-11-19 05:41:23] ⚠️ Failed: https://raw.githubusercontent.com/forgedbyfreedom/forged-by-freedom-st/main/transcripts/DrGabrielleLyon.txt → 404 Client Error: Not Found for url: https://raw.githubusercontent.com/forgedbyfreedom/forged-by-freedom-st/main/transcripts/DrGabrielleLyon.txt
[2025-11-19 05:41:23] ⚠️ Failed: https://raw.githubusercontent.com/forgedbyfreedom/forged-by-freedom-st/main/transcripts/FoundMyFitness.txt → 404 Client Error: Not Found for url: https://raw.githubusercontent.com/forgedbyfreedom/forged-by-freedom-st/main/transcripts/FoundMyFitness.txt
[2025-11-19 05:41:23] ⚠️ Failed: https://raw.githubusercontent.com/forgedbyfreedom/forged-by-freedom-st/main/transcripts/PeterAttiaMD.txt → 404 Client Error: Not Found for url: https://raw.githubusercontent.com/forgedbyfreedom/forged-by-freedom-st/main/transcripts/PeterAttiaMD.txt
[2025-11-19 05:41:23] ⚠️ Failed: https://raw.githubusercontent.com/forgedbyfreedom/forged-by-freedom-st/main/transcripts/RenaissancePeriodization.txt → 404 Client Error: Not Found for url: https://raw.githubusercontent.com/forgedbyfreedom/forged-by-freedom-st/main/transcripts/RenaissancePeriodization.txt
[2025-11-19 05:41:23] ⚠️ Failed: https://raw.githubusercontent.com/forgedbyfreedom/forged-by-freedom-st/main/transcripts/EliteFTS.txt → 404 Client Error: Not Found for url: https://raw.githubusercontent.com/forgedbyfreedom/forged-by-freedom-st/main/transcripts/EliteFTS.txt
[2025-11-19 05:41:23] ⚠️ Failed: https://raw.githubusercontent.com/forgedbyfreedom/forged-by-freedom-st/main/transcripts/JeffNippard.txt → 404 Client Error: Not Found for url: https://raw.githubusercontent.com/forgedbyfreedom/forged-by-freedom-st/main/transcripts/JeffNippard.txt
[2025-11-19 05:41:23] ⚠️ Failed: https://raw.githubusercontent.com/forgedbyfreedom/forged-by-freedom-st/main/transcripts/RyanHumiston.txt → 404 Client Error: Not Found for url: https://raw.githubusercontent.com/forgedbyfreedom/forged-by-freedom-st/main/transcripts/RyanHumiston.txt
[2025-11-19 05:41:24] ⚠️ Failed: https://raw.githubusercontent.com/forgedbyfreedom/forged-by-freedom-st/main/transcripts/NickStrengthandPower.txt → 404 Client Error: Not Found for url: https://raw.githubusercontent.com/forgedbyfreedom/forged-by-freedom-st/main/transcripts/NickStrengthandPower.txt
[2025-11-19 05:41:24] ⚠️ Failed: https://raw.githubusercontent.com/forgedbyfreedom/forged-by-freedom-st/main/transcripts/HighLifeWorkout.txt → 404 Client Error: Not Found for url: https://raw.githubusercontent.com/forgedbyfreedom/forged-by-freedom-st/main/transcripts/HighLifeWorkout.txt
[2025-11-19 05:41:24] ⚠️ Failed: https://raw.githubusercontent.com/forgedbyfreedom/forged-by-freedom-st/main/transcripts/BodybuildingCom.txt → 404 Client Error: Not Found for url: https://raw.githubusercontent.com/forgedbyfreedom/forged-by-freedom-st/main/transcripts/BodybuildingCom.txt
[2025-11-19 05:41:24] ⚠️ Failed: https://raw.githubusercontent.com/forgedbyfreedom/forged-by-freedom-st/main/transcripts/HanyRambod_FST7.txt → 404 Client Error: Not Found for url: https://raw.githubusercontent.com/forgedbyfreedom/forged-by-freedom-st/main/transcripts/HanyRambod_FST7.txt
[2025-11-19 05:41:24] 🎯 Sync complete. 0 transcripts downloaded successfully.
[2025-11-19 05:43:23] 📡 Starting transcript sync...
[2025-11-19 05:43:23] ⚠️ Failed: https://raw.githubusercontent.com/forgedbyfreedom/forged-by-freedom-st/main/ThinkBigBodybuilding/master_transcript.txt → 404 Client Error: Not Found for url: https://raw.githubusercontent.com/forgedbyfreedom/forged-by-freedom-st/main/ThinkBigBodybuilding/master_transcript.txt
[2025-11-19 05:43:23] ⚠️ Failed: https://raw.githubusercontent.com/forgedbyfreedom/forged-by-freedom-st/main/AnabolicBodybuilding/master_transcript.txt → 404 Client Error: Not Found for url: https://raw.githubusercontent.com/forgedbyfreedom/forged-by-freedom-st/main/AnabolicBodybuilding/master_transcript.txt
[2025-11-19 05:43:23] ⚠️ Failed: https://raw.githubusercontent.com/forgedbyfreedom/forged-by-freedom-st/main/DrGabrielleLyon/master_transcript.txt → 404 Client Error: Not Found for url: https://raw.githubusercontent.com/forgedbyfreedom/forged-by-freedom-st/main/DrGabrielleLyon/master_transcript.txt
[2025-11-19 05:43:23] ⚠️ Failed: https://raw.githubusercontent.com/forgedbyfreedom/forged-by-freedom-st/main/FoundMyFitness/master_transcript.txt → 404 Client Error: Not Found for url: https://raw.githubusercontent.com/forgedbyfreedom/forged-by-freedom-st/main/FoundMyFitness/master_transcript.txt
[2025-11-19 05:43:23] ⚠️ Failed: https://raw.githubusercontent.com/forgedbyfreedom/forged-by-freedom-st/main/PeterAttiaMD/master_transcript.txt → 404 Client Error: Not Found for url: https://raw.githubusercontent.com/forgedbyfreedom/forged-by-freedom-st/main/PeterAttiaMD/master_transcript.txt
[2025-11-19 05:43:23] ⚠️ Failed: https://raw.githubusercontent.com/forgedbyfreedom/forged-by-freedom-st/main/RenaissancePeriodization/master_transcript.txt → 404 Client Error: Not Found for url: https://raw.githubusercontent.com/forgedbyfreedom/forged-by-freedom-st/main/RenaissancePeriodization/master_transcript.txt
[2025-11-19 05:43:23] ⚠️ Failed: https://raw.githubusercontent.com/forgedbyfreedom/forged-by-freedom-st/main/EliteFTS/master_transcript.txt → 404 Client Error: Not Found for url: https://raw.githubusercontent.com/forgedbyfreedom/forged-by-freedom-st/main/EliteFTS/master_transcript.txt
[2025-11-19 05:43:23] ⚠️ Failed: https://raw.githubusercontent.com/forgedbyfreedom/forged-by-freedom-st/main/JeffNippard/master_transcript.txt → 404 Client Error: Not Found for url: https://raw.githubusercontent.com/forgedbyfreedom/forged-by-freedom-st/main/JeffNippard/master_transcript.txt
[2025-11-19 05:43:24] ⚠️ Failed: https://raw.githubusercontent.com/forgedbyfreedom/forged-by-freedom-st/main/RyanHumiston/master_transcript.txt → 404 Client Error: Not Found for url: https://raw.githubusercontent.com/forgedbyfreedom/forged-by-freedom-st/main/RyanHumiston/master_transcript.txt
[2025-11-19 05:43:24] ⚠️ Failed: https://raw.githubusercontent.com/forgedbyfreedom/forged-by-freedom-st/main/NickStrengthandPower/master_transcript.txt → 404 Client Error: Not Found for url: https://raw.githubusercontent.com/forgedbyfreedom/forged-by-freedom-st/main/NickStrengthandPower/master_transcript.txt
[2025-11-19 05:43:24] ⚠️ Failed: https://raw.githubusercontent.com/forgedbyfreedom/forged-by-freedom-st/main/HighLifeWorkout/master_transcript.txt → 404 Client Error: Not Found for url: https://raw.githubusercontent.com/forgedbyfreedom/forged-by-freedom-st/main/HighLifeWorkout/master_transcript.txt
[2025-11-19 05:43:24] ⚠️ Failed: https://raw.githubusercontent.com/forgedbyfreedom/forged-by-freedom-st/main/BodybuildingCom/master_transcript.txt → 404 Client Error: Not Found for url: https://raw.githubusercontent.com/forgedbyfreedom/forged-by-freedom-st/main/BodybuildingCom/master_transcript.txt
[2025-11-19 05:43:24] ⚠️ Failed: https://raw.githubusercontent.com/forgedbyfreedom/forged-by-freedom-st/main/HanyRambod_FST7/master_transcript.txt → 404 Client Error: Not Found for url: https://raw.githubusercontent.com/forgedbyfreedom/forged-by-freedom-st/main/HanyRambod_FST7/master_transcript.txt
[2025-11-19 05:43:24] 🎯 Sync complete. 0 transcripts downloaded successfully.
[2025-11-19 05:43:24] 📡 Starting transcript sync...
[2025-11-19 05:43:24] ⚠️ Failed: https://raw.githubusercontent.com/forgedbyfreedom/forged-by-freedom-st/main/transcripts/ThinkBigBodybuilding.txt → 404 Client Error: Not Found for url: https://raw.githubusercontent.com/forgedbyfreedom/forged-by-freedom-st/main/transcripts/ThinkBigBodybuilding.txt
[2025-11-19 05:43:24] ⚠️ Failed: https://raw.githubusercontent.com/forgedbyfreedom/forged-by-freedom-st/main/transcripts/AnabolicBodybuilding.txt → 404 Client Error: Not Found for url: https://raw.githubusercontent.com/forgedbyfreedom/forged-by-freedom-st/main/transcripts/AnabolicBodybuilding.txt
[2025-11-19 05:43:24] ⚠️ Failed: https://raw.githubusercontent.com/forgedbyfreedom/forged-by-freedom-st/main/transcripts/DrGabrielleLyon.txt → 404 Client Error: Not Found for url: https://raw.githubusercontent.com/forgedbyfreedom/forged-by-freedom-st/main/transcripts/DrGabrielleLyon.txt
[2025-11-19 05:43:24] ⚠️ Failed: https://raw.githubusercontent.com/forgedbyfreedom/forged-by-freedom-st/main/transcripts/FoundMyFitness.txt → 404 Client Error: Not Found for url: https://raw.githubusercontent.com/forgedbyfreedom/forged-by-freedom-st/main/transcripts/FoundMyFitness.txt
[2025-11-19 05:43:24] ⚠️ Failed: https://raw.githubusercontent.com/forgedbyfreedom/forged-by-freedom-st/main/transcripts/PeterAttiaMD.txt → 404 Client Error: Not Found for url: https://raw.githubusercontent.com/forgedbyfreedom/forged-by-freedom-st/main/transcripts/PeterAttiaMD.txt
[2025-11-19 05:43:24] ⚠️ Failed: https://raw.githubusercontent.com/forgedbyfreedom/forged-by-freedom-st/main/transcripts/RenaissancePeriodization.txt → 404 Client Error: Not Found for url: https://raw.githubusercontent.com/forgedbyfreedom/forged-by-freedom-st/main/transcripts/RenaissancePeriodization.txt
[2025-11-19 05:43:25] ⚠️ Failed: https://raw.githubusercontent.com/forgedbyfreedom/forged-by-freedom-st/main/transcripts/EliteFTS.txt → 404 Client Error: Not Found for url: https://raw.githubusercontent.com/forgedbyfreedom/forged-by-freedom-st/main/transcripts/EliteFTS.txt
[2025-11-19 05:43:25] ⚠️ Failed: https://raw.githubusercontent.com/forgedbyfreedom/forged-by-freedom-st/main/transcripts/JeffNippard.txt → 404 Client Error: Not Found for url: https://raw.githubusercontent.com/forgedbyfreedom/forged-by-freedom-st/main/transcripts/JeffNippard.txt
[2025-11-19 05:43:25] ⚠️ Failed: https://raw.githubusercontent.com/forgedbyfreedom/forged-by-freedom-st/main/transcripts/RyanHumiston.txt → 404 Client Error: Not Found for url: https://raw.githubusercontent.com/forgedbyfreedom/forged-by-freedom-st/main/transcripts/RyanHumiston.txt
[2025-11-19 05:43:25] ⚠️ Failed: https://raw.githubusercontent.com/forgedbyfreedom/forged-by-freedom-st/main/transcripts/NickStrengthandPower.txt → 404 Client Error: Not Found for url: https://raw.githubusercontent.com/forgedbyfreedom/forged-by-freedom-st/main/transcripts/NickStrengthandPower.txt
[2025-11-19 05:43:25] ⚠️ Failed: https://raw.githubusercontent.com/forgedbyfreedom/forged-by-freedom-st/main/transcripts/HighLifeWorkout.txt → 404 Client Error: Not Found for url: https://raw.githubusercontent.com/forgedbyfreedom/forged-by-freedom-st/main/transcripts/HighLifeWorkout.txt
[2025-11-19 05:43:25] ⚠️ Failed: https://raw.githubusercontent.com/forgedbyfreedom/forged-by-freedom-st/main/transcripts/BodybuildingCom.txt → 404 Client Error: Not Found for url: https://raw.githubusercontent.com/forgedbyfreedom/forged-by-freedom-st/main/transcripts/BodybuildingCom.txt
[2025-11-19 05:43:25] ⚠️ Failed: https://raw.githubusercontent.com/forgedbyfreedom/forged-by-freedom-st/main/transcripts/HanyRambod_FST7.txt → 404 Client Error: Not Found for url: https://raw.githubusercontent.com/forgedbyfreedom/forged-by-freedom-st/main/transcripts/HanyRambod_FST7.txt
[2025-11-19 05:43:25] 🎯 Sync complete. 0 transcripts downloaded successfully.
[2025-11-19 05:44:33] 📡 Starting auto-discovery transcript sync...
[2025-11-19 05:44:33] ⚠️ Failed to crawl https://api.github.com/repos/forgedbyfreedom/forged-by-freedom-st/contents: 404 Client Error: Not Found for url: https://api.github.com/repos/forgedbyfreedom/forged-by-freedom-st/contents
[2025-11-19 05:44:33] 🔍 Found 0 .txt transcript files in repo.
[2025-11-19 05:44:33] 🎯 Sync complete. 0 transcripts downloaded successfully.
[2025-11-19 05:46:46] 📡 Starting authenticated transcript sync...
[2025-11-19 05:46:46] ⚠️ Failed to crawl https://api.github.com/repos/forgedbyfreedom/forged-by-freedom-st/contents: 401 Client Error: Unauthorized for url: https://api.github.com/repos/forgedbyfreedom/forged-by-freedom-st/contents
[2025-11-19 05:46:46] 🔍 Found 0 .txt transcript files in repo.
[2025-11-19 05:46:46] 🎯 Sync complete. 0 transcripts downloaded successfully.
[2025-11-19 20:26:51] 📡 Starting authenticated transcript sync...
[2025-11-19 20:26:53] 🔍 Found 0 .txt transcript files in repository.
[2025-11-19 20:26:53] ⚠️ No transcript files found — check repo structure or permissions.
[2025-11-19 20:26:53] 📡 Starting authenticated transcript sync...
[2025-11-19 20:26:54] ⚠️ Failed to crawl https://api.github.com/repos/forgedbyfreedom/forged-by-freedom-st/contents: 401 Client Error: Unauthorized for url: https://api.github.com/repos/forgedbyfreedom/forged-by-freedom-st/contents
[2025-11-19 20:26:54] 🔍 Found 0 .txt transcript files in repo.
[2025-11-19 20:26:54] 🎯 Sync complete. 0 transcripts downloaded successfully.
[2025-11-19 20:34:06] 📡 Starting authenticated transcript sync...
[2025-11-19 20:34:08] 🔍 Found 0 .txt transcript files in repository.
[2025-11-19 20:34:08] ⚠️ No transcript files found — check repo structure or permissions.
[2025-11-19 20:34:08] 📡 Starting authenticated transcript sync...
[2025-11-19 20:34:09] ⚠️ Failed to crawl https://api.github.com/repos/forgedbyfreedom/forged-by-freedom-st/contents: 401 Client Error: Unauthorized for url: https://api.github.com/repos/forgedbyfreedom/forged-by-freedom-st/contents
[2025-11-19 20:34:09] 🔍 Found 0 .txt transcript files in repo.
[2025-11-19 20:34:09] 🎯 Sync complete. 0 transcripts downloaded successfully.
[2025-11-19 20:39:26] ✅ Downloaded fetch_summary.txt
[2025-11-19 20:39:26] 🎯 Sync complete. 1 transcripts downloaded or updated.
[2025-11-19 20:39:26] 📡 Starting authenticated transcript sync...
[2025-11-19 20:39:27] ⚠️ Failed to crawl https://api.github.com/repos/forgedbyfreedom/forged-by-freedom-st/contents: 401 Client Error: Unauthorized for url: https://api.github.com/repos/forgedbyfreedom/forged-by-freedom-st/contents
[2025-11-19 20:39:27] 🔍 Found 0 .txt transcript files in repo.
[2025-11-19 20:39:27] 🎯 Sync complete. 0 transcripts downloaded successfully.
[2025-11-19 05:41:23] 📡 Starting transcript sync...
[2025-11-19 05:41:23] ⚠️ Failed: https://raw.githubusercontent.com/forgedbyfreedom/forged-by-freedom-st/main/transcripts/ThinkBigBodybuilding.txt → 404 Client Error: Not Found for url: https://raw.githubusercontent.com/forgedbyfreedom/forged-by-freedom-st/main/transcripts/ThinkBigBodybuilding.txt
[2025-11-19 05:41:23] ⚠️ Failed: https://raw.githubusercontent.com/forgedbyfreedom/forged-by-freedom-st/main/transcripts/AnabolicBodybuilding.txt → 404 Client Error: Not Found for url: https://raw.githubusercontent.com/forgedbyfreedom/forged-by-freedom-st/main/transcripts/AnabolicBodybuilding.txt
[2025-11-19 05:41:23] ⚠️ Failed: https://raw.githubusercontent.com/forgedbyfreedom/forged-by-freedom-st/main/transcripts/DrGabrielleLyon.txt → 404 Client Error: Not Found for url: https://raw.githubusercontent.com/forgedbyfreedom/forged-by-freedom-st/main/transcripts/DrGabrielleLyon.txt
[2025-11-19 05:41:23] ⚠️ Failed: https://raw.githubusercontent.com/forgedbyfreedom/forged-by-freedom-st/main/transcripts/FoundMyFitness.txt → 404 Client Error: Not Found for url: https://raw.githubusercontent.com/forgedbyfreedom/forged-by-freedom-st/main/transcripts/FoundMyFitness.txt
[2025-11-19 05:41:23] ⚠️ Failed: https://raw.githubusercontent.com/forgedbyfreedom/forged-by-freedom-st/main/transcripts/PeterAttiaMD.txt → 404 Client Error: Not Found for url: https://raw.githubusercontent.com/forgedbyfreedom/forged-by-freedom-st/main/transcripts/PeterAttiaMD.txt
[2025-11-19 05:41:23] ⚠️ Failed: https://raw.githubusercontent.com/forgedbyfreedom/forged-by-freedom-st/main/transcripts/RenaissancePeriodization.txt → 404 Client Error: Not Found for url: https://raw.githubusercontent.com/forgedbyfreedom/forged-by-freedom-st/main/transcripts/RenaissancePeriodization.txt
[2025-11-19 05:41:23] ⚠️ Failed: https://raw.githubusercontent.com/forgedbyfreedom/forged-by-freedom-st/main/transcripts/EliteFTS.txt → 404 Client Error: Not Found for url: https://raw.githubusercontent.com/forgedbyfreedom/forged-by-freedom-st/main/transcripts/EliteFTS.txt
[2025-11-19 05:41:23] ⚠️ Failed: https://raw.githubusercontent.com/forgedbyfreedom/forged-by-freedom-st/main/transcripts/JeffNippard.txt → 404 Client Error: Not Found for url: https://raw.githubusercontent.com/forgedbyfreedom/forged-by-freedom-st/main/transcripts/JeffNippard.txt
[2025-11-19 05:41:23] ⚠️ Failed: https://raw.githubusercontent.com/forgedbyfreedom/forged-by-freedom-st/main/transcripts/RyanHumiston.txt → 404 Client Error: Not Found for url: https://raw.githubusercontent.com/forgedbyfreedom/forged-by-freedom-st/main/transcripts/RyanHumiston.txt
[2025-11-19 05:41:24] ⚠️ Failed: https://raw.githubusercontent.com/forgedbyfreedom/forged-by-freedom-st/main/transcripts/NickStrengthandPower.txt → 404 Client Error: Not Found for url: https://raw.githubusercontent.com/forgedbyfreedom/forged-by-freedom-st/main/transcripts/NickStrengthandPower.txt
[2025-11-19 05:41:24] ⚠️ Failed: https://raw.githubusercontent.com/forgedbyfreedom/forged-by-freedom-st/main/transcripts/HighLifeWorkout.txt → 404 Client Error: Not Found for url: https://raw.githubusercontent.com/forgedbyfreedom/forged-by-freedom-st/main/transcripts/HighLifeWorkout.txt
[2025-11-19 05:41:24] ⚠️ Failed: https://raw.githubusercontent.com/forgedbyfreedom/forged-by-freedom-st/main/transcripts/BodybuildingCom.txt → 404 Client Error: Not Found for url: https://raw.githubusercontent.com/forgedbyfreedom/forged-by-freedom-st/main/transcripts/BodybuildingCom.txt
[2025-11-19 05:41:24] ⚠️ Failed: https://raw.githubusercontent.com/forgedbyfreedom/forged-by-freedom-st/main/transcripts/HanyRambod_FST7.txt → 404 Client Error: Not Found for url: https://raw.githubusercontent.com/forgedbyfreedom/forged-by-freedom-st/main/transcripts/HanyRambod_FST7.txt
[2025-11-19 05:41:24] 🎯 Sync complete. 0 transcripts downloaded successfully.
[2025-11-19 05:43:23] 📡 Starting transcript sync...
[2025-11-19 05:43:23] ⚠️ Failed: https://raw.githubusercontent.com/forgedbyfreedom/forged-by-freedom-st/main/ThinkBigBodybuilding/master_transcript.txt → 404 Client Error: Not Found for url: https://raw.githubusercontent.com/forgedbyfreedom/forged-by-freedom-st/main/ThinkBigBodybuilding/master_transcript.txt
[2025-11-19 05:43:23] ⚠️ Failed: https://raw.githubusercontent.com/forgedbyfreedom/forged-by-freedom-st/main/AnabolicBodybuilding/master_transcript.txt → 404 Client Error: Not Found for url: https://raw.githubusercontent.com/forgedbyfreedom/forged-by-freedom-st/main/AnabolicBodybuilding/master_transcript.txt
[2025-11-19 05:43:23] ⚠️ Failed: https://raw.githubusercontent.com/forgedbyfreedom/forged-by-freedom-st/main/DrGabrielleLyon/master_transcript.txt → 404 Client Error: Not Found for url: https://raw.githubusercontent.com/forgedbyfreedom/forged-by-freedom-st/main/DrGabrielleLyon/master_transcript.txt
[2025-11-19 05:43:23] ⚠️ Failed: https://raw.githubusercontent.com/forgedbyfreedom/forged-by-freedom-st/main/FoundMyFitness/master_transcript.txt → 404 Client Error: Not Found for url: https://raw.githubusercontent.com/forgedbyfreedom/forged-by-freedom-st/main/FoundMyFitness/master_transcript.txt
[2025-11-19 05:43:23] ⚠️ Failed: https://raw.githubusercontent.com/forgedbyfreedom/forged-by-freedom-st/main/PeterAttiaMD/master_transcript.txt → 404 Client Error: Not Found for url: https://raw.githubusercontent.com/forgedbyfreedom/forged-by-freedom-st/main/PeterAttiaMD/master_transcript.txt
[2025-11-19 05:43:23] ⚠️ Failed: https://raw.githubusercontent.com/forgedbyfreedom/forged-by-freedom-st/main/RenaissancePeriodization/master_transcript.txt → 404 Client Error: Not Found for url: https://raw.githubusercontent.com/forgedbyfreedom/forged-by-freedom-st/main/RenaissancePeriodization/master_transcript.txt
[2025-11-19 05:43:23] ⚠️ Failed: https://raw.githubusercontent.com/forgedbyfreedom/forged-by-freedom-st/main/EliteFTS/master_transcript.txt → 404 Client Error: Not Found for url: https://raw.githubusercontent.com/forgedbyfreedom/forged-by-freedom-st/main/EliteFTS/master_transcript.txt
[2025-11-19 05:43:23] ⚠️ Failed: https://raw.githubusercontent.com/forgedbyfreedom/forged-by-freedom-st/main/JeffNippard/master_transcript.txt → 404 Client Error: Not Found for url: https://raw.githubusercontent.com/forgedbyfreedom/forged-by-freedom-st/main/JeffNippard/master_transcript.txt
[2025-11-19 05:43:24] ⚠️ Failed: https://raw.githubusercontent.com/forgedbyfreedom/forged-by-freedom-st/main/RyanHumiston/master_transcript.txt → 404 Client Error: Not Found for url: https://raw.githubusercontent.com/forgedbyfreedom/forged-by-freedom-st/main/RyanHumiston/master_transcript.txt
[2025-11-19 05:43:24] ⚠️ Failed: https://raw.githubusercontent.com/forgedbyfreedom/forged-by-freedom-st/main/NickStrengthandPower/master_transcript.txt → 404 Client Error: Not Found for url: https://raw.githubusercontent.com/forgedbyfreedom/forged-by-freedom-st/main/NickStrengthandPower/master_transcript.txt
[2025-11-19 05:43:24] ⚠️ Failed: https://raw.githubusercontent.com/forgedbyfreedom/forged-by-freedom-st/main/HighLifeWorkout/master_transcript.txt → 404 Client Error: Not Found for url: https://raw.githubusercontent.com/forgedbyfreedom/forged-by-freedom-st/main/HighLifeWorkout/master_transcript.txt
[2025-11-19 05:43:24] ⚠️ Failed: https://raw.githubusercontent.com/forgedbyfreedom/forged-by-freedom-st/main/BodybuildingCom/master_transcript.txt → 404 Client Error: Not Found for url: https://raw.githubusercontent.com/forgedbyfreedom/forged-by-freedom-st/main/BodybuildingCom/master_transcript.txt
[2025-11-19 05:43:24] ⚠️ Failed: https://raw.githubusercontent.com/forgedbyfreedom/forged-by-freedom-st/main/HanyRambod_FST7/master_transcript.txt → 404 Client Error: Not Found for url: https://raw.githubusercontent.com/forgedbyfreedom/forged-by-freedom-st/main/HanyRambod_FST7/master_transcript.txt
[2025-11-19 05:43:24] 🎯 Sync complete. 0 transcripts downloaded successfully.
[2025-11-19 05:43:24] 📡 Starting transcript sync...
[2025-11-19 05:43:24] ⚠️ Failed: https://raw.githubusercontent.com/forgedbyfreedom/forged-by-freedom-st/main/transcripts/ThinkBigBodybuilding.txt → 404 Client Error: Not Found for url: https://raw.githubusercontent.com/forgedbyfreedom/forged-by-freedom-st/main/transcripts/ThinkBigBodybuilding.txt
[2025-11-19 05:43:24] ⚠️ Failed: https://raw.githubusercontent.com/forgedbyfreedom/forged-by-freedom-st/main/transcripts/AnabolicBodybuilding.txt → 404 Client Error: Not Found for url: https://raw.githubusercontent.com/forgedbyfreedom/forged-by-freedom-st/main/transcripts/AnabolicBodybuilding.txt
[2025-11-19 05:43:24] ⚠️ Failed: https://raw.githubusercontent.com/forgedbyfreedom/forged-by-freedom-st/main/transcripts/DrGabrielleLyon.txt → 404 Client Error: Not Found for url: https://raw.githubusercontent.com/forgedbyfreedom/forged-by-freedom-st/main/transcripts/DrGabrielleLyon.txt
[2025-11-19 05:43:24] ⚠️ Failed: https://raw.githubusercontent.com/forgedbyfreedom/forged-by-freedom-st/main/transcripts/FoundMyFitness.txt → 404 Client Error: Not Found for url: https://raw.githubusercontent.com/forgedbyfreedom/forged-by-freedom-st/main/transcripts/FoundMyFitness.txt
[2025-11-19 05:43:24] ⚠️ Failed: https://raw.githubusercontent.com/forgedbyfreedom/forged-by-freedom-st/main/transcripts/PeterAttiaMD.txt → 404 Client Error: Not Found for url: https://raw.githubusercontent.com/forgedbyfreedom/forged-by-freedom-st/main/transcripts/PeterAttiaMD.txt
[2025-11-19 05:43:24] ⚠️ Failed: https://raw.githubusercontent.com/forgedbyfreedom/forged-by-freedom-st/main/transcripts/RenaissancePeriodization.txt → 404 Client Error: Not Found for url: https://raw.githubusercontent.com/forgedbyfreedom/forged-by-freedom-st/main/transcripts/RenaissancePeriodization.txt
[2025-11-19 05:43:25] ⚠️ Failed: https://raw.githubusercontent.com/forgedbyfreedom/forged-by-freedom-st/main/transcripts/EliteFTS.txt → 404 Client Error: Not Found for url: https://raw.githubusercontent.com/forgedbyfreedom/forged-by-freedom-st/main/transcripts/EliteFTS.txt
[2025-11-19 05:43:25] ⚠️ Failed: https://raw.githubusercontent.com/forgedbyfreedom/forged-by-freedom-st/main/transcripts/JeffNippard.txt → 404 Client Error: Not Found for url: https://raw.githubusercontent.com/forgedbyfreedom/forged-by-freedom-st/main/transcripts/JeffNippard.txt
[2025-11-19 05:43:25] ⚠️ Failed: https://raw.githubusercontent.com/forgedbyfreedom/forged-by-freedom-st/main/transcripts/RyanHumiston.txt → 404 Client Error: Not Found for url: https://raw.githubusercontent.com/forgedbyfreedom/forged-by-freedom-st/main/transcripts/RyanHumiston.txt
[2025-11-19 05:43:25] ⚠️ Failed: https://raw.githubusercontent.com/forgedbyfreedom/forged-by-freedom-st/main/transcripts/NickStrengthandPower.txt → 404 Client Error: Not Found for url: https://raw.githubusercontent.com/forgedbyfreedom/forged-by-freedom-st/main/transcripts/NickStrengthandPower.txt
[2025-11-19 05:43:25] ⚠️ Failed: https://raw.githubusercontent.com/forgedbyfreedom/forged-by-freedom-st/main/transcripts/HighLifeWorkout.txt → 404 Client Error: Not Found for url: https://raw.githubusercontent.com/forgedbyfreedom/forged-by-freedom-st/main/transcripts/HighLifeWorkout.txt
[2025-11-19 05:43:25] ⚠️ Failed: https://raw.githubusercontent.com/forgedbyfreedom/forged-by-freedom-st/main/transcripts/BodybuildingCom.txt → 404 Client Error: Not Found for url: https://raw.githubusercontent.com/forgedbyfreedom/forged-by-freedom-st/main/transcripts/BodybuildingCom.txt
[2025-11-19 05:43:25] ⚠️ Failed: https://raw.githubusercontent.com/forgedbyfreedom/forged-by-freedom-st/main/transcripts/HanyRambod_FST7.txt → 404 Client Error: Not Found for url: https://raw.githubusercontent.com/forgedbyfreedom/forged-by-freedom-st/main/transcripts/HanyRambod_FST7.txt
[2025-11-19 05:43:25] 🎯 Sync complete. 0 transcripts downloaded successfully.
[2025-11-19 05:44:33] 📡 Starting auto-discovery transcript sync...
[2025-11-19 05:44:33] ⚠️ Failed to crawl https://api.github.com/repos/forgedbyfreedom/forged-by-freedom-st/contents: 404 Client Error: Not Found for url: https://api.github.com/repos/forgedbyfreedom/forged-by-freedom-st/contents
[2025-11-19 05:44:33] 🔍 Found 0 .txt transcript files in repo.
[2025-11-19 05:44:33] 🎯 Sync complete. 0 transcripts downloaded successfully.
[2025-11-19 05:46:46] 📡 Starting authenticated transcript sync...
[2025-11-19 05:46:46] ⚠️ Failed to crawl https://api.github.com/repos/forgedbyfreedom/forged-by-freedom-st/contents: 401 Client Error: Unauthorized for url: https://api.github.com/repos/forgedbyfreedom/forged-by-freedom-st/contents
[2025-11-19 05:46:46] 🔍 Found 0 .txt transcript files in repo.
[2025-11-19 05:46:46] 🎯 Sync complete. 0 transcripts downloaded successfully.
[2025-11-19 20:26:51] 📡 Starting authenticated transcript sync...
[2025-11-19 20:26:53] 🔍 Found 0 .txt transcript files in repository.
[2025-11-19 20:26:53] ⚠️ No transcript files found — check repo structure or permissions.
[2025-11-19 20:26:53] 📡 Starting authenticated transcript sync...
[2025-11-19 20:26:54] ⚠️ Failed to crawl https://api.github.com/repos/forgedbyfreedom/forged-by-freedom-st/contents: 401 Client Error: Unauthorized for url: https://api.github.com/repos/forgedbyfreedom/forged-by-freedom-st/contents
[2025-11-19 20:26:54] 🔍 Found 0 .txt transcript files in repo.
[2025-11-19 20:26:54] 🎯 Sync complete. 0 transcripts downloaded successfully.
[2025-11-19 20:34:06] 📡 Starting authenticated transcript sync...
[2025-11-19 20:34:08] 🔍 Found 0 .txt transcript files in repository.
[2025-11-19 20:34:08] ⚠️ No transcript files found — check repo structure or permissions.
[2025-11-19 20:34:08] 📡 Starting authenticated transcript sync...
[2025-11-19 20:34:09] ⚠️ Failed to crawl https://api.github.com/repos/forgedbyfreedom/forged-by-freedom-st/contents: 401 Client Error: Unauthorized for url: https://api.github.com/repos/forgedbyfreedom/forged-by-freedom-st/contents
[2025-11-19 20:34:09] 🔍 Found 0 .txt transcript files in repo.
[2025-11-19 20:34:09] 🎯 Sync complete. 0 transcripts downloaded successfully.
[2025-11-19 20:39:26] ✅ Downloaded fetch_summary.txt
[2025-11-19 20:39:26] 🎯 Sync complete. 1 transcripts downloaded or updated.
[2025-11-19 20:39:26] 📡 Starting authenticated transcript sync...
[2025-11-19 20:39:27] ⚠️ Failed to crawl https://api.github.com/repos/forgedbyfreedom/forged-by-freedom-st/contents: 401 Client Error: Unauthorized for url: https://api.github.com/repos/forgedbyfreedom/forged-by-freedom-st/contents
[2025-11-19 20:39:27] 🔍 Found 0 .txt transcript files in repo.
[2025-11-19 20:39:27] 🎯 Sync complete. 0 transcripts downloaded successfully.
[2025-11-19 05:41:23] 📡 Starting transcript sync...
[2025-11-19 05:41:23] ⚠️ Failed: https://raw.githubusercontent.com/forgedbyfreedom/forged-by-freedom-st/main/transcripts/ThinkBigBodybuilding.txt → 404 Client Error: Not Found for url: https://raw.githubusercontent.com/forgedbyfreedom/forged-by-freedom-st/main/transcripts/ThinkBigBodybuilding.txt
[2025-11-19 05:41:23] ⚠️ Failed: https://raw.githubusercontent.com/forgedbyfreedom/forged-by-freedom-st/main/transcripts/AnabolicBodybuilding.txt → 404 Client Error: Not Found for url: https://raw.githubusercontent.com/forgedbyfreedom/forged-by-freedom-st/main/transcripts/AnabolicBodybuilding.txt
[2025-11-19 05:41:23] ⚠️ Failed: https://raw.githubusercontent.com/forgedbyfreedom/forged-by-freedom-st/main/transcripts/DrGabrielleLyon.txt → 404 Client Error: Not Found for url: https://raw.githubusercontent.com/forgedbyfreedom/forged-by-freedom-st/main/transcripts/DrGabrielleLyon.txt
[2025-11-19 05:41:23] ⚠️ Failed: https://raw.githubusercontent.com/forgedbyfreedom/forged-by-freedom-st/main/transcripts/FoundMyFitness.txt → 404 Client Error: Not Found for url: https://raw.githubusercontent.com/forgedbyfreedom/forged-by-freedom-st/main/transcripts/FoundMyFitness.txt
[2025-11-19 05:41:23] ⚠️ Failed: https://raw.githubusercontent.com/forgedbyfreedom/forged-by-freedom-st/main/transcripts/PeterAttiaMD.txt → 404 Client Error: Not Found for url: https://raw.githubusercontent.com/forgedbyfreedom/forged-by-freedom-st/main/transcripts/PeterAttiaMD.txt
[2025-11-19 05:41:23] ⚠️ Failed: https://raw.githubusercontent.com/forgedbyfreedom/forged-by-freedom-st/main/transcripts/RenaissancePeriodization.txt → 404 Client Error: Not Found for url: https://raw.githubusercontent.com/forgedbyfreedom/forged-by-freedom-st/main/transcripts/RenaissancePeriodization.txt
[2025-11-19 05:41:23] ⚠️ Failed: https://raw.githubusercontent.com/forgedbyfreedom/forged-by-freedom-st/main/transcripts/EliteFTS.txt → 404 Client Error: Not Found for url: https://raw.githubusercontent.com/forgedbyfreedom/forged-by-freedom-st/main/transcripts/EliteFTS.txt
[2025-11-19 05:41:23] ⚠️ Failed: https://raw.githubusercontent.com/forgedbyfreedom/forged-by-freedom-st/main/transcripts/JeffNippard.txt → 404 Client Error: Not Found for url: https://raw.githubusercontent.com/forgedbyfreedom/forged-by-freedom-st/main/transcripts/JeffNippard.txt
[2025-11-19 05:41:23] ⚠️ Failed: https://raw.githubusercontent.com/forgedbyfreedom/forged-by-freedom-st/main/transcripts/RyanHumiston.txt → 404 Client Error: Not Found for url: https://raw.githubusercontent.com/forgedbyfreedom/forged-by-freedom-st/main/transcripts/RyanHumiston.txt
[2025-11-19 05:41:24] ⚠️ Failed: https://raw.githubusercontent.com/forgedbyfreedom/forged-by-freedom-st/main/transcripts/NickStrengthandPower.txt → 404 Client Error: Not Found for url: https://raw.githubusercontent.com/forgedbyfreedom/forged-by-freedom-st/main/transcripts/NickStrengthandPower.txt
[2025-11-19 05:41:24] ⚠️ Failed: https://raw.githubusercontent.com/forgedbyfreedom/forged-by-freedom-st/main/transcripts/HighLifeWorkout.txt → 404 Client Error: Not Found for url: https://raw.githubusercontent.com/forgedbyfreedom/forged-by-freedom-st/main/transcripts/HighLifeWorkout.txt
[2025-11-19 05:41:24] ⚠️ Failed: https://raw.githubusercontent.com/forgedbyfreedom/forged-by-freedom-st/main/transcripts/BodybuildingCom.txt → 404 Client Error: Not Found for url: https://raw.githubusercontent.com/forgedbyfreedom/forged-by-freedom-st/main/transcripts/BodybuildingCom.txt
[2025-11-19 05:41:24] ⚠️ Failed: https://raw.githubusercontent.com/forgedbyfreedom/forged-by-freedom-st/main/transcripts/HanyRambod_FST7.txt → 404 Client Error: Not Found for url: https://raw.githubusercontent.com/forgedbyfreedom/forged-by-freedom-st/main/transcripts/HanyRambod_FST7.txt
[2025-11-19 05:41:24] 🎯 Sync complete. 0 transcripts downloaded successfully.
[2025-11-19 05:43:23] 📡 Starting transcript sync...
[2025-11-19 05:43:23] ⚠️ Failed: https://raw.githubusercontent.com/forgedbyfreedom/forged-by-freedom-st/main/ThinkBigBodybuilding/master_transcript.txt → 404 Client Error: Not Found for url: https://raw.githubusercontent.com/forgedbyfreedom/forged-by-freedom-st/main/ThinkBigBodybuilding/master_transcript.txt
[2025-11-19 05:43:23] ⚠️ Failed: https://raw.githubusercontent.com/forgedbyfreedom/forged-by-freedom-st/main/AnabolicBodybuilding/master_transcript.txt → 404 Client Error: Not Found for url: https://raw.githubusercontent.com/forgedbyfreedom/forged-by-freedom-st/main/AnabolicBodybuilding/master_transcript.txt
[2025-11-19 05:43:23] ⚠️ Failed: https://raw.githubusercontent.com/forgedbyfreedom/forged-by-freedom-st/main/DrGabrielleLyon/master_transcript.txt → 404 Client Error: Not Found for url: https://raw.githubusercontent.com/forgedbyfreedom/forged-by-freedom-st/main/DrGabrielleLyon/master_transcript.txt
[2025-11-19 05:43:23] ⚠️ Failed: https://raw.githubusercontent.com/forgedbyfreedom/forged-by-freedom-st/main/FoundMyFitness/master_transcript.txt → 404 Client Error: Not Found for url: https://raw.githubusercontent.com/forgedbyfreedom/forged-by-freedom-st/main/FoundMyFitness/master_transcript.txt
[2025-11-19 05:43:23] ⚠️ Failed: https://raw.githubusercontent.com/forgedbyfreedom/forged-by-freedom-st/main/PeterAttiaMD/master_transcript.txt → 404 Client Error: Not Found for url: https://raw.githubusercontent.com/forgedbyfreedom/forged-by-freedom-st/main/PeterAttiaMD/master_transcript.txt
[2025-11-19 05:43:23] ⚠️ Failed: https://raw.githubusercontent.com/forgedbyfreedom/forged-by-freedom-st/main/RenaissancePeriodization/master_transcript.txt → 404 Client Error: Not Found for url: https://raw.githubusercontent.com/forgedbyfreedom/forged-by-freedom-st/main/RenaissancePeriodization/master_transcript.txt
[2025-11-19 05:43:23] ⚠️ Failed: https://raw.githubusercontent.com/forgedbyfreedom/forged-by-freedom-st/main/EliteFTS/master_transcript.txt → 404 Client Error: Not Found for url: https://raw.githubusercontent.com/forgedbyfreedom/forged-by-freedom-st/main/EliteFTS/master_transcript.txt
[2025-11-19 05:43:23] ⚠️ Failed: https://raw.githubusercontent.com/forgedbyfreedom/forged-by-freedom-st/main/JeffNippard/master_transcript.txt → 404 Client Error: Not Found for url: https://raw.githubusercontent.com/forgedbyfreedom/forged-by-freedom-st/main/JeffNippard/master_transcript.txt
[2025-11-19 05:43:24] ⚠️ Failed: https://raw.githubusercontent.com/forgedbyfreedom/forged-by-freedom-st/main/RyanHumiston/master_transcript.txt → 404 Client Error: Not Found for url: https://raw.githubusercontent.com/forgedbyfreedom/forged-by-freedom-st/main/RyanHumiston/master_transcript.txt
[2025-11-19 05:43:24] ⚠️ Failed: https://raw.githubusercontent.com/forgedbyfreedom/forged-by-freedom-st/main/NickStrengthandPower/master_transcript.txt → 404 Client Error: Not Found for url: https://raw.githubusercontent.com/forgedbyfreedom/forged-by-freedom-st/main/NickStrengthandPower/master_transcript.txt
[2025-11-19 05:43:24] ⚠️ Failed: https://raw.githubusercontent.com/forgedbyfreedom/forged-by-freedom-st/main/HighLifeWorkout/master_transcript.txt → 404 Client Error: Not Found for url: https://raw.githubusercontent.com/forgedbyfreedom/forged-by-freedom-st/main/HighLifeWorkout/master_transcript.txt
[2025-11-19 05:43:24] ⚠️ Failed: https://raw.githubusercontent.com/forgedbyfreedom/forged-by-freedom-st/main/BodybuildingCom/master_transcript.txt → 404 Client Error: Not Found for url: https://raw.githubusercontent.com/forgedbyfreedom/forged-by-freedom-st/main/BodybuildingCom/master_transcript.txt
[2025-11-19 05:43:24] ⚠️ Failed: https://raw.githubusercontent.com/forgedbyfreedom/forged-by-freedom-st/main/HanyRambod_FST7/master_transcript.txt → 404 Client Error: Not Found for url: https://raw.githubusercontent.com/forgedbyfreedom/forged-by-freedom-st/main/HanyRambod_FST7/master_transcript.txt
[2025-11-19 05:43:24] 🎯 Sync complete. 0 transcripts downloaded successfully.
[2025-11-19 05:43:24] 📡 Starting transcript sync...
[2025-11-19 05:43:24] ⚠️ Failed: https://raw.githubusercontent.com/forgedbyfreedom/forged-by-freedom-st/main/transcripts/ThinkBigBodybuilding.txt → 404 Client Error: Not Found for url: https://raw.githubusercontent.com/forgedbyfreedom/forged-by-freedom-st/main/transcripts/ThinkBigBodybuilding.txt
[2025-11-19 05:43:24] ⚠️ Failed: https://raw.githubusercontent.com/forgedbyfreedom/forged-by-freedom-st/main/transcripts/AnabolicBodybuilding.txt → 404 Client Error: Not Found for url: https://raw.githubusercontent.com/forgedbyfreedom/forged-by-freedom-st/main/transcripts/AnabolicBodybuilding.txt
[2025-11-19 05:43:24] ⚠️ Failed: https://raw.githubusercontent.com/forgedbyfreedom/forged-by-freedom-st/main/transcripts/DrGabrielleLyon.txt → 404 Client Error: Not Found for url: https://raw.githubusercontent.com/forgedbyfreedom/forged-by-freedom-st/main/transcripts/DrGabrielleLyon.txt
[2025-11-19 05:43:24] ⚠️ Failed: https://raw.githubusercontent.com/forgedbyfreedom/forged-by-freedom-st/main/transcripts/FoundMyFitness.txt → 404 Client Error: Not Found for url: https://raw.githubusercontent.com/forgedbyfreedom/forged-by-freedom-st/main/transcripts/FoundMyFitness.txt
[2025-11-19 05:43:24] ⚠️ Failed: https://raw.githubusercontent.com/forgedbyfreedom/forged-by-freedom-st/main/transcripts/PeterAttiaMD.txt → 404 Client Error: Not Found for url: https://raw.githubusercontent.com/forgedbyfreedom/forged-by-freedom-st/main/transcripts/PeterAttiaMD.txt
[2025-11-19 05:43:24] ⚠️ Failed: https://raw.githubusercontent.com/forgedbyfreedom/forged-by-freedom-st/main/transcripts/RenaissancePeriodization.txt → 404 Client Error: Not Found for url: https://raw.githubusercontent.com/forgedbyfreedom/forged-by-freedom-st/main/transcripts/RenaissancePeriodization.txt
[2025-11-19 05:43:25] ⚠️ Failed: https://raw.githubusercontent.com/forgedbyfreedom/forged-by-freedom-st/main/transcripts/EliteFTS.txt → 404 Client Error: Not Found for url: https://raw.githubusercontent.com/forgedbyfreedom/forged-by-freedom-st/main/transcripts/EliteFTS.txt
[2025-11-19 05:43:25] ⚠️ Failed: https://raw.githubusercontent.com/forgedbyfreedom/forged-by-freedom-st/main/transcripts/JeffNippard.txt → 404 Client Error: Not Found for url: https://raw.githubusercontent.com/forgedbyfreedom/forged-by-freedom-st/main/transcripts/JeffNippard.txt
[2025-11-19 05:43:25] ⚠️ Failed: https://raw.githubusercontent.com/forgedbyfreedom/forged-by-freedom-st/main/transcripts/RyanHumiston.txt → 404 Client Error: Not Found for url: https://raw.githubusercontent.com/forgedbyfreedom/forged-by-freedom-st/main/transcripts/RyanHumiston.txt
[2025-11-19 05:43:25] ⚠️ Failed: https://raw.githubusercontent.com/forgedbyfreedom/forged-by-freedom-st/main/transcripts/NickStrengthandPower.txt → 404 Client Error: Not Found for url: https://raw.githubusercontent.com/forgedbyfreedom/forged-by-freedom-st/main/transcripts/NickStrengthandPower.txt
[2025-11-19 05:43:25] ⚠️ Failed: https://raw.githubusercontent.com/forgedbyfreedom/forged-by-freedom-st/main/transcripts/HighLifeWorkout.txt → 404 Client Error: Not Found for url: https://raw.githubusercontent.com/forgedbyfreedom/forged-by-freedom-st/main/transcripts/HighLifeWorkout.txt
[2025-11-19 05:43:25] ⚠️ Failed: https://raw.githubusercontent.com/forgedbyfreedom/forged-by-freedom-st/main/transcripts/BodybuildingCom.txt → 404 Client Error: Not Found for url: https://raw.githubusercontent.com/forgedbyfreedom/forged-by-freedom-st/main/transcripts/BodybuildingCom.txt
[2025-11-19 05:43:25] ⚠️ Failed: https://raw.githubusercontent.com/forgedbyfreedom/forged-by-freedom-st/main/transcripts/HanyRambod_FST7.txt → 404 Client Error: Not Found for url: https://raw.githubusercontent.com/forgedbyfreedom/forged-by-freedom-st/main/transcripts/HanyRambod_FST7.txt
[2025-11-19 05:43:25] 🎯 Sync complete. 0 transcripts downloaded successfully.
[2025-11-19 05:44:33] 📡 Starting auto-discovery transcript sync...
[2025-11-19 05:44:33] ⚠️ Failed to crawl https://api.github.com/repos/forgedbyfreedom/forged-by-freedom-st/contents: 404 Client Error: Not Found for url: https://api.github.com/repos/forgedbyfreedom/forged-by-freedom-st/contents
[2025-11-19 05:44:33] 🔍 Found 0 .txt transcript files in repo.
[2025-11-19 05:44:33] 🎯 Sync complete. 0 transcripts downloaded successfully.
[2025-11-19 05:46:46] 📡 Starting authenticated transcript sync...
[2025-11-19 05:46:46] ⚠️ Failed to crawl https://api.github.com/repos/forgedbyfreedom/forged-by-freedom-st/contents: 401 Client Error: Unauthorized for url: https://api.github.com/repos/forgedbyfreedom/forged-by-freedom-st/contents
[2025-11-19 05:46:46] 🔍 Found 0 .txt transcript files in repo.
[2025-11-19 05:46:46] 🎯 Sync complete. 0 transcripts downloaded successfully.
[2025-11-19 20:26:51] 📡 Starting authenticated transcript sync...
[2025-11-19 20:26:53] 🔍 Found 0 .txt transcript files in repository.
[2025-11-19 20:26:53] ⚠️ No transcript files found — check repo structure or permissions.
[2025-11-19 20:26:53] 📡 Starting authenticated transcript sync...
[2025-11-19 20:26:54] ⚠️ Failed to crawl https://api.github.com/repos/forgedbyfreedom/forged-by-freedom-st/contents: 401 Client Error: Unauthorized for url: https://api.github.com/repos/forgedbyfreedom/forged-by-freedom-st/contents
[2025-11-19 20:26:54] 🔍 Found 0 .txt transcript files in repo.
[2025-11-19 20:26:54] 🎯 Sync complete. 0 transcripts downloaded successfully.
[2025-11-19 20:34:06] 📡 Starting authenticated transcript sync...
[2025-11-19 20:34:08] 🔍 Found 0 .txt transcript files in repository.
[2025-11-19 20:34:08] ⚠️ No transcript files found — check repo structure or permissions.
[2025-11-19 20:34:08] 📡 Starting authenticated transcript sync...
[2025-11-19 20:34:09] ⚠️ Failed to crawl https://api.github.com/repos/forgedbyfreedom/forged-by-freedom-st/contents: 401 Client Error: Unauthorized for url: https://api.github.com/repos/forgedbyfreedom/forged-by-freedom-st/contents
[2025-11-19 20:34:09] 🔍 Found 0 .txt transcript files in repo.
[2025-11-19 20:34:09] 🎯 Sync complete. 0 transcripts downloaded successfully.
[2025-11-19 20:39:26] ✅ Downloaded fetch_summary.txt
[2025-11-19 20:39:26] 🎯 Sync complete. 1 transcripts downloaded or updated.
[2025-11-19 20:39:26] 📡 Starting authenticated transcript sync...
[2025-11-19 20:39:27] ⚠️ Failed to crawl https://api.github.com/repos/forgedbyfreedom/forged-by-freedom-st/contents: 401 Client Error: Unauthorized for url: https://api.github.com/repos/forgedbyfreedom/forged-by-freedom-st/contents
[2025-11-19 20:39:27] 🔍 Found 0 .txt transcript files in repo.
[2025-11-19 20:39:27] 🎯 Sync complete. 0 transcripts downloaded successfully.
